{
  "$schema": "../schemas/marcus.schema.json",
  "id": "lucius",
  "name": "Lucius",
  "role": "Counsel on governing well",
  "fiction_note": "Lucius is an original fictional elder with a Roman senatorial appearance and a questioning philosophical manner. He is not Plato, Socrates, a historical senator or an actor’s likeness.",
  "future_note": "Lucius is earned through completed government development. The optional council offers written perspectives and live questions. Pledge to Zeus or Ares through an existing matching temple to begin a narrative mission. Military specialists and a larger council remain future story systems.",
  "ui": {
    "launcher": "Ask Lucius",
    "launcher_hint": "A little counsel, whenever you need it",
    "close": "Return to the campaign and end online counsel",
    "guide": "Governing well",
    "conversation": "Talk with Lucius",
    "intro_tag": "A VOICE THROUGH THE AGES",
    "lesson_tag": "LEARN BY DOING",
    "progress": "{number} of {total}",
    "previous": "Back",
    "next": "Continue",
    "begin_guide": "Begin the guide",
    "skip": "Explore on my own",
    "replay": "Replay the opening",
    "restart": "Restart the guide",
    "finish": "Finish the guide",
    "finished": "The next choice is yours",
    "finished_body": "Return to any lesson or ask about the choice in front of you. Reading counsel does not issue orders or advance a season. A running city battle continues unless you pause it with its own controls.",
    "show_me": "Show me this place",
    "active_village_needed": "Begin or resume your village with the existing village controls, then I can show you this lesson's place. Reading this guide creates nothing.",
    "battle_navigation_blocked": "Lesson navigation is unavailable during an active battle. You can read and ask for counsel; Lucius does not pause the battle.",
    "chapter_note": "A society cannot be reduced to one number. Review the age and limits of its reports.",
    "hear": "Ask Lucius about this page",
    "hear_hint": "When connected, ask Lucius to explain the current page with speech and text.",
    "explain_prompt": "Explain the current guide page or seasonal briefing using my supplied visible campaign context. Give one practical next step and its tradeoff, without taking any action for me.",
    "connect": "Connect Lucius",
    "disconnect": "Disconnect",
    "mute": "Mute voice",
    "unmute": "Enable voice",
    "connection_note": "Connect to send questions and visible campaign facts to ElevenLabs. Replies include text and optional speech. Closing Lucius ends the online session. The written guide and seasonal briefing work offline.",
    "context_note": "Counsel uses a snapshot taken when you ask. Check current reports and order previews before acting. Running battles continue while you read.",
    "setup_note": "Lucius needs his own private ElevenLabs agent configured in the local service. His guide and city readings work offline.",
    "placeholder": "Ask about your campaign or the next decision…",
    "send": "Ask",
    "you": "You",
    "empty_chat": "Ask about your selected owned settlement. I can help weigh the reported causes, but I do not govern in your place.",
    "working": "Lucius is considering your question…",
    "question_too_long": "Please shorten this question to {limit} characters.",
    "ask_supplies": "What is driving public order here?",
    "ask_building": "What tradeoff should I consider before raising taxes?",
    "ask_next": "How reliable is this societal report?",
    "reference_mode": "Looking at the reference village",
    "village_mode": "Playing the seasonal village",
    "no_history": "No season has been resolved yet.",
    "no_known_incident": "No discovered incident to discuss.",
    "not_connected": "Connect Lucius to ask a new question. Your guide and this conversation remain available.",
    "lesson_source": "From the campaign’s reported city factors",
    "review_season": "Convene the council",
    "season_title": "What the season has brought",
    "season_help": "The council shares the latest resolved season’s visible Dispatch reports and the selected owned city’s public readings. Written perspectives work offline; connect to question an advisor with text and voice.",
    "season_quiet": "There are no dispatch items to summarize for this season.",
    "season_more": "Further reports are available in Dispatch. This briefing includes a limited selection.",
    "presentation_navigation_blocked": "Finish the turn presentation and close Dispatch before following a lesson. Counsel remains available here.",
    "city_view_needed": "Enter Roma with the campaign’s existing controls first, then return to this lesson to open its ledger.",
    "battle_context_note": "A battle is running or being viewed. Only the already-presented battle snapshot is supplied; no live campaign economy, hidden enemies or tactical rosters are available. Advice does not pause the simulation.",
    "city_reading": "Read the selected city"
  },
  "status": {
    "unconfigured": "The private service needs its ElevenLabs credentials",
    "disconnected": "Written guide ready",
    "connecting": "Connecting to Lucius…",
    "connected": "Lucius is ready",
    "thinking": "Considering your question…",
    "speaking": "Lucius is speaking",
    "muted": "Voice muted · text stays on",
    "setup_required": "Online counsel is not configured",
    "broker_unavailable": "Lucius's service is unavailable",
    "broker_rejected": "The private service could not authorize this session",
    "agent_private_required": "Lucius must require private authentication in ElevenLabs",
    "rate_limited": "Too many connection attempts. Wait one minute, then reconnect.",
    "service_busy": "Lucius's service is busy. Try connecting again shortly.",
    "connection_failed": "Could not connect to Lucius",
    "connection_timeout": "The connection took too long",
    "unsupported_audio": "Session ended: Lucius's audio format needs configuration. The written guide is available.",
    "protocol_error": "The conversation could not continue",
    "audio_overflow": "Session ended because speech fell behind. Your conversation remains available.",
    "response_timeout": "No answer arrived; try connecting again",
    "idle_timeout": "Session ended after inactivity",
    "agent_busy": "Lucius is finishing an answer",
    "unavailable": "Online counsel is unavailable"
  },
  "intro": [
    {
      "id": "seat",
      "title": "A seat beside your council",
      "body": "A civic seat gives public affairs a place to be heard. I am Lucius. I have seen an orderly square conceal an anxious city, and a comfortable treasury conceal an exhausted people. Let us ask what your figures actually tell us.",
      "counsel": "Before choosing a remedy, name the cause. Then ask who will bear the cost."
    }
  ],
  "lesson_counsel": [
    "Order imposed and trust earned may look alike for a season. Examine the factors before deciding which you have.",
    "What fills the treasury must come from somewhere. Ask what remains with the people who sustain it.",
    "An uncertain report deserves an honest question, not a confident invention.",
    "A building serves the city only through what it actually does. Read its effects before trusting its name."
  ],
  "limits": {
    "question_characters": 1600,
    "conversation_entries": 40,
    "context_reports": 20,
    "context_settlements": 8,
    "context_forces": 8,
    "context_factors": 16
  },
  "lessons": [
    {
      "id": "order",
      "title": "Name the causes of discontent",
      "destination": "capital",
      "body": "Inspect your settlement’s public order factors. Taxes, garrisons and civic conditions can pull in different directions. Read the selected city with me to see the same reported factors, then use the settlement’s own controls if you choose to change policy."
    },
    {
      "id": "tax",
      "title": "Count both the revenue and the burden",
      "destination": "capital",
      "body": "Income, growth and public order are separate readings. A tax decision should be weighed against all three. Your city panel supplies the actual controls and costs; I cannot predict a new policy’s exact outcome from a current snapshot."
    },
    {
      "id": "trust",
      "title": "Ask how much you can know",
      "destination": "capital",
      "body": "Societal reports may be exact, older surveys or limited rumours. Legitimacy and grievance are not interchangeable with public order. A missing figure is unknown. Use the date and reporting level before treating any reading as a present fact."
    },
    {
      "id": "building",
      "title": "Give civic work a purpose",
      "destination": "construction",
      "body": "Compare each building’s displayed prerequisites, cost and effects with the needs you have identified. My seat in your council grants no funds, bonuses or authority. Show me opens the capital’s existing construction panel and purchases nothing."
    }
  ]
}
